{
  "environment": {
    "name": "mysql-development",
    "description": "Development environment with MySQL database for testing database-intensive features locally on LXD. Includes basic UDP/HTTP trackers without HTTPS or monitoring. Ideal for developing and testing MySQL-specific functionality or migration scripts."
  },
  "ssh_credentials": {
    "private_key_path": "/home/torrust/.ssh/testing_rsa",
    "public_key_path": "/home/torrust/.ssh/testing_rsa.pub"
  },
  "provider": {
    "provider": "lxd",
    "profile_name": "torrust-profile-mysql-development"
  },
  "tracker": {
    "core": {
      "database": {
        "driver": "mysql",
        "host": "mysql",
        "port": 3306,
        "database_name": "tracker",
        "username": "tracker_user",
        "password": "dev_password"
      },
      "private": false
    },
    "udp_trackers": [
      {
        "bind_address": "0.0.0.0:6969"
      }
    ],
    "http_trackers": [
      {
        "bind_address": "0.0.0.0:7070"
      }
    ],
    "http_api": {
      "bind_address": "0.0.0.0:1212",
      "admin_token": "MyAccessToken"
    },
    "health_check_api": {
      "bind_address": "127.0.0.1:1313"
    }
  }
}