{
  "environment": {
    "name": "udp-only",
    "description": "Minimal UDP-only tracker deployment on LXD using SQLite. No HTTP API, monitoring, or backups - just the core BitTorrent UDP tracker protocol. Perfect for testing UDP tracker functionality or running a simple, lightweight tracker without web interface."
  },
  "ssh_credentials": {
    "private_key_path": "/home/torrust/.ssh/testing_rsa",
    "public_key_path": "/home/torrust/.ssh/testing_rsa.pub"
  },
  "provider": {
    "provider": "lxd",
    "profile_name": "torrust-profile-udp-only"
  },
  "tracker": {
    "core": {
      "database": {
        "driver": "sqlite3",
        "database_name": "tracker.db"
      },
      "private": false
    },
    "udp_trackers": [
      {
        "bind_address": "0.0.0.0:6969"
      }
    ],
    "http_trackers": [],
    "http_api": {
      "bind_address": "0.0.0.0:1212",
      "admin_token": "UdpOnlyToken"
    },
    "health_check_api": {
      "bind_address": "127.0.0.1:1313"
    }
  }
}